{
  "$schema": "../schemas/profile-v1.schema.json",
  "schema_version": "1.0",
  "profile_id": "linux-node-postgres-v1",
  "version": "1.1.1",
  "catalog_revision": "2026.08.2",
  "status": "active",
  "description": "Ubuntu LTS, Node LTS, Prisma, PostgreSQL and digest-pinned OCI baseline.",
  "required_components": [
    {"component_id": "os.ubuntu.24-04-4", "allowed_states": ["preferred"]},
    {"component_id": "runtime.node.24", "allowed_states": ["preferred"], "transitions": [{"component_id": "runtime.node.22", "allowed_states": ["sunset"]}]},
    {"component_id": "package.npm.11", "allowed_states": ["preferred"], "transitions": [{"component_id": "package.npm.10", "allowed_states": ["sunset"]}]},
    {"component_id": "orm.prisma.7", "allowed_states": ["preferred"], "transitions": [{"component_id": "orm.prisma.5", "allowed_states": ["sunset"]}]},
    {"component_id": "database.postgresql.18", "allowed_states": ["preferred"], "transitions": [{"component_id": "database.postgresql.16", "allowed_states": ["supported"]}]},
    {"component_id": "container.docker-engine.29", "allowed_states": ["preferred"]},
    {"component_id": "container.compose.5", "allowed_states": ["preferred"]},
    {"component_id": "proxy.nginx.1-30", "allowed_states": ["preferred"]},
    {"component_id": "framework.next.16", "allowed_states": ["preferred"]},
    {"component_id": "frontend.react.19", "allowed_states": ["preferred"], "transitions": [{"component_id": "frontend.react.18", "allowed_states": ["sunset"]}]},
    {"component_id": "toolchain.typescript.6", "allowed_states": ["preferred"], "transitions": [{"component_id": "toolchain.typescript.5", "allowed_states": ["sunset"]}]},
    {"component_id": "oci.node.24-bookworm-slim", "allowed_states": ["preferred"], "transitions": [{"component_id": "oci.node.22-bookworm-slim", "allowed_states": ["sunset"]}]}
  ],
  "compatibility_rules": [
    "Node must be an upstream LTS version supported by the selected Prisma major.",
    "Prisma 7 requires Node ^20.19, ^22.12 or ^24, TypeScript >=5.4 and a driver adapter.",
    "next@16.2.11 accepts React/react-dom ^19.0.0; the catalog requires both npm packages to use the same audited stable exact version, while project build/browser compatibility remains required.",
    "A transition selects exactly one component per slot, requires an absolute HTTPS migration Issue plus one matching unexpired exception, and never permits a prohibited component.",
    "Next.js 14 is recorded as prohibited evidence and intentionally has no transition allowlist entry.",
    "PostgreSQL major adoption requires a separate backup, restore and rollback-capable project Change.",
    "Every production OCI base and application image is identified by sha256 digest; mutable-only tags fail closed."
  ],
  "delivery_contracts": ["docker-release/v1", "pm2-legacy"],
  "constraints": {
    "deployment": "docker-release/v1 is preferred; pm2-legacy only describes delivery ownership and does not grant deployment capability.",
    "data_storage": "PostgreSQL data resides on approved local or managed persistent storage, never an application container layer.",
    "concurrency": "Database connection and worker limits are owned and load-tested by each application Change.",
    "availability": "Availability topology is declared outside this architecture lock and remains owned by host/release governance.",
    "backup": "A database major Change requires a verified backup before mutation.",
    "restore_drill": "A restore drill is required before production adoption of a new PostgreSQL major."
  }
}
